"nome","resumo","coordenador"
"LIGA ACADÊMICA DE ORTOPEDIA UERJ (LAO)","As doenças relacionadas ao envelhecimento vêm ganhando cada vez maior importância uma vez que existe uma tendência mundial ao aumento da longevidade. Um estado crítico relacionado ao sistema musculoesquelético encontra relação direta com a sua fragilidade e degeneração com repercussão para mobilidade fisiológica e independência do idoso. Alguns dos contribuintes mais importantes no idoso para a perda funcional que leva ao comprometimento e incapacidade são as múltiplas mudanças na estrutura e função do sistema musculoesquelético. Se não forem controladas podem ocorrer complicações com risco de vida como quedas e fraturas ósseas associadas à fraqueza muscular. As alterações biológicas decorrentes do envelhecimento contribuem para o declínio da força e da massa muscular esquelética alterações nas propriedades contráteis do músculo desempenho motor prejudicado redução da massa e força óssea diminuição da flexibilidade e amplitude de movimento articular e perda da capacidade dos tecidos moles de sustentar e se recuperar de uma lesão. O entendimento de todas essas alterações fisiológicas e das doenças a ela relacionadas incluída na forma de ensino médico através da criação de uma liga acadêmica ortopédica direcionada para especialidade é de relevância ímpar. A liga amplia e se estende para a integração junto aos pacientes seus familiares e toda comunidade potencializando o conteúdo informativo a cerca de medidas preventivas e reconhecimento de alterações agravantes de saúde. Tendo o hupe como referência em assistência ensino e pesquisa e estando o mesmo integrado ao sus a liga acadêmica de ortopedia terá como referência sua estrutura baseada no serviço de ortopedia onde estará envolvida desde o atendimento ambulatorial até a internação. A liga atuará portanto em caráter educacional e científico atuando no processo dde formulação e criação do conhecimento de forma contínua possibilitando assim ações interativas e integrativas entre a uerj e a sociedade.","Liszt Palmeira De Oliveira"
"PROGRAMA DE ORIENTAÇÃO EM SEXUALIDADE PREVENÇÃO DE IST/AIDS E DISTRIBUIÇÃO DE PRESERVATIVOS - PROSS","Este projeto tem como objetivo assegurar o acesso de adolescentes e jovens às informações e orientações sobre saúde e sexualidades ampliar ações de prevenção de ist`s/aids e distribuição de preservativos internos externos e géis lubrificante. Assim como contribuir para a formação de jovens do ensino médio e superior e profissionais da rede intersetorial especialmente saúde e educação. A fundamentação teórico-metodológica parte de perspectivas críticas e interseccionais que vai ao encontro das ações políticas dos movimentos sociais combativos sem qualquer tipo de discriminação e preconceito. Trabalhamos a partir da concepção de sexualidade não biologicista fundamentada criticamente pelas ciências sociais compreendendo-a para além do corpo. Utilizamos a metodologia participativa de “jovem para jovem” na construção do conhecimento facilitando a troca de informações entre jovens bolsistas e adolescentes-jovens inseridos/as/es no projeto a fim de torná-los/as/es multiplicadores e possibilitar uma maior conscientização sobre o tema. Nesse sentido realizamos orientações individuais e coletivas assim como oficinas em escolas da rede pública municipal e estadual e atividades de formação de jovens graduandos/as e pós-graduandos/as. Também construímos materiais educativos autorais com linguagem direcionada à adolescentes e jovens visando promover a diversidade e inclusão na saúde. Os dados oficiais dos últimos boletins epidemiológicos do ministério da saúde e da organização mundial de saúde demonstram o crescimento de infecções sexualmente transmitidas como sífilis e hiv/aids em jovens brasileiros. Destacamos a importância e a necessidade de ampliar o número de pessoas atingidas pelo projeto buscando dar mais visibilidade às ações desenvolvidas no núcleo de estudo da saúde do adolescente (nesa) e na rede intersetorial para a juventude do rio de janeiro.","Viviane De Queiroz"
"TREINAMENTO DE FORÇA PARA OS SERVIDORES ATIVOS INATIVOS E TERCEIRIZADOS DA UERJ","O objetivo do presente projeto de extensão consiste em implementar um programa sistemático individualizado de prescrição controle e avaliação de exercícios corporais de força para servidores da uerj direcionados ao incremento das suas aptidões músculo-esqueléticas. Isso porque o treinamento de força pode proporcionar ganhos de qualidade de vida por gerar melhorias na postura corporal; reduzir a massa gorda e incrementar a magra; ampliar a tolerância à fadiga e incrementar a mobilidade articular. Em conjunto tais efeitos tendem a reduzir o estresse cotidiano; elevar o auto-conceito modificar a imagem corporal e reduzir a fadiga laboral. O público alvo será constituído de servidores ativos inativos e terceirizados da uerj. Metodologicamente a execução do projeto envolverá as seguintes etapas: 1) aferição das condições clínicas dos indivíduos interessados em participar por meio de laudos ergométricos e de perfil bioquímico do sangue; 2) para os sujeitos clinicamente aptos será feita uma avaliação da antropometria corporal; força; flexibilidade; auto conceito; imagem corporal; postura; hábitos alimentares; percepções de estresse hábitos de exercitação física e qualidade de vida. Essas informações serão empregadas na elaboração das séries de exercícios; equacionamento das quantidades de treino em microciclos; determinação dos parâmetros de controle da intensidade da exercitação. Os efeitos de treino serão avaliados a cada cinco semanas através da replicação dos testes iniciais. Os dados serão tabulados segundo as estatísticas descritiva associativa e inferencial. Na vigésima quarta e quadragésima oitava semanas ocorrerá a análise parcial dos dados gerados pela reunião da equipe de trabalho para fins de diagnóstico. O mesmo procedimento se repetirá na sexagésima e nonagésima sexta semanas para a avaliação final do projeto. Como resultados projeta-se que os servidores venham a ter melhorias morfológicas socioafetivas motoras condicionais e comportamentais.","Dirceu Ribeiro Nogueira Da Gama"
"SEGURANÇA ALIMENTAR EM PRÁTICAS EDUCATIVAS","As doenças crônicas não transmissíveis (dcnt) como diabetes hipertensão arterial doenças cardiovasculares respiratórias crônicas e cânceres representam um dos maiores desafios para a saúde pública atual. Globalmente são responsáveis por cerca de 70% das mortes anuais afetando indivíduos famílias e sistemas de saúde. No brasil as dcnt lideram as causas de morbimortalidade frequentemente associadas a estilos de vida inadequados envelhecimento populacional e desigualdades sociais. Os determinantes sociais de saúde (dss) desempenham um papel fundamental no entendimento das dcnt influenciando diretamente a saúde da população. Fatores como educação renda condições de trabalho saneamento básico e acesso aos serviços de saúde criam um contexto de vulnerabilidades que agrava a incidência dessas doenças. No brasil as desigualdades socioeconômicas aumentam a exposição a fatores de risco como alimentação inadequada sedentarismo e tabagismo reforçando a necessidade de estratégias preventivas interdisciplinares e abordagens territoriais para reduzir o impacto das dcnt na sociedade. Em conjunto com outros projetos de extensão do campus uerj zona oeste realizaremos a conscientização sobre temas relacionados a saúde pública atendendo a demandas das escolas parceiras e estimulando a realização de atividades em tempo real garantindo o significado da aprendizagem e sua possível incorporação para mudança de hábitos. Estimulando o protagonismo do graduando para formação de profissionais mais completos evoluindo junto com as gerações.","Sabrina Da Silva Dias"
"CUIDADOS A GESTANTES COM DIABETES","Aprimorar o cuidado pré-natal a gestantes com diabetes assistidas no ambulatório de diabetes da policlínica piquet carneiro garantindo assistência qualificada e humanizada a tais gestantes ao criar um espaço de troca de saberes e experiências tanto para os indivíduos assistidos pelo projeto quanto para profissionais e alunos atuantes no mesmo.","Carolina Aurelio Vieira Andrade De Vasco"
"PROMOÇÃO DE SAÚDE BUCAL EM ATLETAS DE ALTO RENDIMENTO","A saúde bucal é uma parte extremamente importante na saúde geral da população e principalmente em atletas de alto rendimento e em especial os de baixa renda. Lesões tumores cáries mal-oclusões e processos inflamatórios na cavidade bucal podem ter repercussões na saúde sistêmica geral e influenciar negativamente o rendimento de atletas durante a sua fase de treinamento. Especialmente atletas de baixa renda com pouco acesso ao tratamento odontológico podem sofrer com a agudização destes processos que colocam em risco a saúde geral e participação do atleta em eventos esportivos comprometendo todo treinamento e investimentos realizados durante anos. O treinamento a alimentação e a dinâmica de alguns esportes também podem ter impacto na saúde bucal de alguns atletas provocando desgaste dentário hipersensibilidade dentinária e erosão dental. O objetivo deste projeto é promover a saúde bucal de atletas de alto rendimento em especial os de baixa renda através de um programa de diagnóstico clínico e radiológico tratamento e prevenção das lesões encontradas no esporte.","Eduardo Muniz Barretto Tinoco"
"RECADO FARMACÊUTICO","O projeto recado farmacêutico promove integração entre ensino pesquisa e extensão por meio da disseminação do conhecimento técnico-científico de maneira acessível e dialógica. As ações incluem palestras oficinas rodas de conversa e produção de materiais educativos sobre educação em saúde e voltados à comunidade. O público-alvo é diverso e abrange usuários do sistema público de saúde profissionais de diferentes áreas e estudantes. A metodologia inclui estratégias lúdicas e participativas que incentivam a troca de saberes e a construção coletiva do conhecimento garantindo que as demandas sociais do território sejam atendidas. A avaliação das ações é baseada em indicadores qualitativos e quantitativos como o número de participantes impacto na formação acadêmica da equipe retorno do público externo e alcance das produções acadêmicas. O projeto estabelece parcerias institucionais para fortalecer a interação dialógica e garantir impacto transformador na comunidade. Além disso a interdisciplinaridade e a interprofissionalidade são promovidas por meio da união entre diferentes áreas do conhecimento consolidando a proposta de formação cidadã e difusão científica.","Bárbara Da Silva e Souza Lorca"
"PROGRAMA DE CONDICIONAMENTO FÍSICO E REABILITAÇÃO MOTORA PARA PACIENTES PÓS-AVC CRÔNICO","O acidente vascular cerebral (avc) pode ser definido como um déficit neurológico atribuído a uma lesão focal aguda do sistema nervoso central por uma causa vascular incluindo isquemia (infarto cerebral) hemorragia intracerebral e hemorragia subaracnóidea. Trata-se de uma doença com enorme impacto pessoal familiar e social uma vez que sobreviventes ao avc frequentemente apresentam impedimentos motores que exercem impacto negativo importante na capacidade física dessa população favorecendo o comportamento sedentário bem como o desenvolvimento ou agravamento de comorbidades como hipertensão diabetes obesidade doenças cardiovasculares além de aumentar a probabilidade da ocorrência de um novo avc. Em virtude disso o exercício físico tem assumido posição central em programas de reabilitação para pacientes pós-avc visando o aprimoramento da sua aptidão física e trazendo benefícios importantes sob o ponto de vista clínico (pela sua relação inversa com mortalidade e no controle de diversos fatores de risco) quanto do ponto de vista funcional (pela sua relação direta com a capacidade física). Assim o presente projeto de extensão oferece um programa de atividades físicas supervisionadas à comunidade com vistas à reabilitação motora de pacientes acometidos por avc. As aulas serão ministradas três vezes por semana no centro de treinamento do laboratório de atividade física e promoção da saúde - labsau (rua são francisco xavier 524 – bloco f – sala 8121. Telefone: 21 2334-0775).","Felipe Amorim Da Cunha"
"ENFREABILITAR: O OLHAR DA ENFERMAGEM PARA AS PESSOAS COM DEFICIÊNCIA E EM CUIDADOS DE REABILITAÇÃO.","O projeto de extensão tem como objetivo geral: promover ações de cuidados às pessoas com deficiência com transtornos do neurodesenvolvimento pessoas em cuidados de reabilitação e seus familiares. Criado na faculdade de enfermagem da uerj o projeto expandiu-se ao longo dos anos e hoje conta com uma equipe multiprofissional formada por membros internos e externos à universidade desenvolvendo ações que ultrapassam os muros da instituição. Promove diversas iniciativas voltadas à inclusão e ao cuidado entre elas: colo de mãe entre nós tecendo inclusão #seliganainclusão e tecendo o cuidado. Além dessas ações realizamos cursos palestras e eventos voltados para a promoção da acessibilidade e da assistência integral. O impacto do enfreabiitar uerj também se estende ao ambiente digital por meio de um canal no youtube e um perfil no instagram onde são compartilhadas informações e conteúdo educativo sobre a área de atuação. São estabelecidas parcerias estratégicas que potencializam o trabalho como o projeto aipen que visa a inclusão e permanência de alunos com deficiência e transtornos da neurodiversidade na faculdade de enfermagem da uerj o programa de residência de enfermagem em saúde do adolescente da uerj e outros projetos de pesquisa e extensão universitária. Além disso integra o programa procriar ampliando o alcance e impacto na sociedade. Com um compromisso contínuo com a inclusão acessibilidade e humanização dos cuidados o enfreabilitar uerj segue promovendo mudanças significativas transformando vidas dentro e fora do ambiente acadêmico.","Livia Fajin De Mello"
"ALEGRIA CONTAGIA","Este projeto visa articular ensino pesquisa e extensão na atenção integral à saúde da criança. As atividades extensionistas contam com a participação de professores e estudantes de enfermagem da uerj em parceria com a equipe multiprofissional das unidades hospitalares e de saúde envolvidas do município do rio de janeiro os profissionais de saúde que lidam com crianças hospitalizadas e suas famílias ajudam a preparar crianças para cirurgias e procedimentos. Esse projeto tem o objetivo de realizar um trabalho com a equipe de saude demonstrando a importãncia de utilizar o lúdico para minimizar o sofrimento da hospitalização infantil do adolescente e adulto e suas familias . Preparar as crianças para a experiência da hospitalização e os procedimentos relacionados baseia-se no princípio de que o medo do desconhecido (fantasia) excede o medo do conhecido. Por isso reduzir os elementos desconhecidos diminui o medo direcionando as energias para lidar com outros estresses inevitáveis da hospitalização beneficiando o potencial de crescimento da experiência. Em muitos hospitais especialistas em desenvolvimento infantil profissionais de saúde com ampla experiência no crescimento e desenvolvimento e nas necessidades psicossociais especiais das crianças hospitalizadas e suas famílias ajudam a preparar crianças para hospitalização cirurgias e procedimentos. Um trabalho conjunto entre a equipe de enfermagem o especialista em desenvolvimento infantil e outros membros da equipe de saúde ajuda a garantir a melhor experiência possível no hospital para a criança e a família. (wong; 2018) este projeto pretende colaborar com estas propostas citadas no sentido de disseminar os novos paradigmas de inclusão do lúdico e da brncadeira no cuidado da criança adolescente e adulto hospitalizados","Ana Claudia Moreira Monteiro"
"LIGA ACADÊMICA EM ESTOMATERAPIA DA UERJ – LAESTOUERJ","Esta proposta trata das atividades da liga acadêmica em estomaterapia da uerj vinculada à faculdade de enfermagem. A estomaterapia é uma área especializada da enfermagem voltada ao cuidado de pessoas com feridas estomias incontinências anal e urinária fístulas drenos e cateteres. As ligas acadêmicas (la) são organizações estudantis sem fins lucrativos apartidárias e sem vínculo religioso com duração indeterminada. Seu principal objetivo é aprofundar o conhecimento em áreas específicas reunindo estudantes de graduação e sendo orientadas por profissionais ligados à instituição de ensino superior. A liga acadêmica em estomaterapia da uerj tem como objetivo geral desenvolver estratégias eficazes e inovadoras para a promoção do conhecimento na área alinhadas às diretrizes de ensino pesquisa assistência e extensão universitária. Além disso suas atividades estão em conformidade com os princípios do projeto político-pedagógico da faculdade de enfermagem da uerj. O público-alvo inclui estudantes de graduação em enfermagem além de técnicos e profissionais da área. A metodologia adotada é diversificada e planejada de acordo com os objetivos da liga abrangendo aulas expositivas (presenciais e online) rodas de conversa cursos de capacitação teórico-prática eventos científicos produção e divulgação de materiais didáticos-instrutivos bem como a publicação de livros e artigos científicos entre outras iniciativas. .","Carolina Cabral Pereira Da Costa"
"GENTES NAS REDES: INFORMAÇÕES E TECNOLOGIAS DE CUIDADO PARA JOVENS VIVENDO COM HIV/AIDS.","O projeto se articula no sentido de ser um difusor de informações e resultados com a pesquisa “tecnologias de cuidado de jovens vivendo com hiv/aids (jvha): estratégias inovadoras de promoção da saúde mental e adesão ao tratamento antirretroviral” coordenado pela professora proponente. O objetivo principal é contribuir com a operacionalização e divulgação do portal gentes um site que reúne informações de relevância para os jvha em relação ao autocuidado nas esferas física e mental. Além disso difunde especialmente via instagram informações relevantes e tecnologias de cuidado para jvha. Os jvha vivenciam um conjunto de vulnerabilidades e desafios no convívio com a doença. Entre esses desafios desatacam-se os impactos pessoais e sociais do estigma da doença e dos efeitos colaterais da terapia antirretroviral (tarv) na rotina nos cuidados com o corpo com a sexualidade e a reprodução. As observações de campo de nossos estudos mostram que não são raros relatos de abandono de tratamento sobretudo entre os infectados por transmissão vertical (da mãe para o bebê) de ansiedade e depressão sendo comum o uso de psicotrópicos associado à tarv. As dificuldades na adesão têm gerado desfechos indesejáveis como adoecimento e até mesmo a morte prematura. Portanto para além das tecnologias de cuidado e digitais acionadas nesse projeto para os próximos anos trazemos como inovação grupos de acolhimento para jvha ofertados semanalmente no serviço de psicologia aplicada (spa) do instituto de psicologia (ip). Os grupos além de atender a uma demanda de cuidado em saúde mental dos jvha ajudará a qualificar as informações do portal e instagram gentes ((https://gentes.Ims.Uerj.Br/ e https://www.Instagram.Com/gentes.Uerj/). Apostamos em uma metodologia que envolve os próprios jovens no processo de desenvolvimento dos dispositivos de cuidado com ações ética e politicamente alinhadas com os direitos humanos e com a integralidade como princípio do sistema único de saúde (sus).","Claudia Carneiro Da Cunha"
"DIFUSÃO DA COMUNICAÇÃO NÃO VIOLENTA","Qual a importância da comunicação nas relações dentro e fora da universidade? Somos seres relacionais e a comunicação é elo fundamental na conexão entre nós. Os conflitos residem muitas vezes em ruídos tanto sobre o conteúdo quanto como sobre como a mensagem é expressada. Tendo como base a comunicação não violenta (cnv) sistematiza pelo norte americano marshall rosenberg a proposta é oferecer para a comunidade interna e externa projeto de desenvolvimento de habilidades de expressão do ser com vistas ao bem viver utilizando a prática do acroyoga como ferramenta. A comunicação não violenta é a vivência de uma linguagem como exercício do poder compartilhado de potência de autenticidade com empatia. O entendimento de linguagem à luz da cnv inclui tanto a expressão verbal quanto a não verbal isto é abrange além das palavras também as atitudes e os pensamentos. A disciplina do acroyoga ainda é recente e pouco popularizada na sociedade mas as suas 2 principais bases são já bem difundidas: yoga e acrobacia. A junção dessas duas disciplinas faz com que o acroyoga seja uma atividade comunitária onde a conexão com os outros é muito importante e é feita de forma não violenta de acordo com os princípios do yoga. Dessa forma ela serve como uma excelente ferramenta lúdica e de desafios para aprendizagem e difusão do cnv.","Gustavo De Barros"
"OFICINAS CULINÁRIAS PARA COMUNIDADE ACADÊMICA DA UERJ","Os hábitos alimentares influenciam a saúde e o surgimento de doenças crônicas não transmissíveis. Entre 2013 e 2019 houve queda no consumo de feijão especialmente entre jovens. A produção de leguminosas migrou para regiões afastadas e secas reduzindo sua disponibilidade e reforçando o estigma que associa esses alimentos a populações de menor renda. Além disso a perda de conhecimento sobre produção e preparo preocupa especialistas. Nutricionalmente as leguminosas são fontes de fibras proteínas vitaminas do complexo b e minerais como ferro cálcio e magnésio. A redução do consumo pode impactar negativamente a qualidade da alimentação comprometendo a ingestão de nutrientes essenciais. Preparar refeições em casa está associado a uma dieta mais equilibrada e oficinas culinárias podem ajudar a reverter essa tendência incentivando o consumo de leguminosas. As oficinas promovem educação alimentar e desenvolvimento de habilidades na cozinha. No entanto barreiras como falta de tempo e conhecimento dificultam a adesão. Intervenções que ensinam planejamento de refeições e preparo em grande quantidade podem facilitar a adoção de hábitos saudáveis. A internet é uma ferramenta importante para disseminar receitas e técnicas mas as leguminosas ainda são pouco representadas nos canais culinários online. O projeto propõe oficinas culinárias e elaboração de materiais para incentivar o consumo de leguminosas abordando planejamento alimentar técnicas de preparo e avaliação de aceitação das receitas. As receitas serão avaliadas quanto à sustentabilidade saudabilidade viabilidade financeira e exequibilidade. As oficinas com até 15 participantes ocorrerão no laboratório da uerj ou outros espaços parceiros. A avaliação ocorrerá por questionários discussões e perquisas de opinião.","Ana Claudia Mazzonetto"
"PROMOÇÃO DE SAÚDE MENTAL EM ESCOLAS","A política de saúde mental para crianças e adolescentes surgiu com a incumbência de implementar e ampliar a oferta de redes de cuidado para essa clientela. São adotados como princípios básicos do novo modelo a acessibilidade universal a noção de crianças e adolescentes como sujeitos singulares e integrais bem como a construção de redes assistenciais articuladas intra e intersetorialmente. No entanto desafios são colocados ao seu desenvolvimento tornando-se necessário aprimorar ações de cuidado intersetoriais com a efetiva participação de usuários e familiares junto a setores como a educação assistência social e o campo da justiça/direitos. Uma forma de enfrentar tal desafio é implementando ações de promoção de saúde mental nas escolas ainda incipientes no cenário brasileiro. A promoção da saúde mental se articula a partir de iniciativas que ambicionam desenvolver as habilidades potenciais dos sujeitos em perceber interpretar e modificar as relações que travam consigo mesmos e com seu entorno expandindo suas possibilidades de laços e interações sociais. Afasta-se de um modelo de saúde que compreende os indivíduos como clientes/pacientes de uma rede de saúde para compreendê-los enquanto cidadãos ativos e participativos nos processos decisórios de suas vidas sua saúde e do sistema de saúde ao qual pertencem. O presente projeto de extensão tem como objetivo desenvolver uma iniciativa de promoção de saúde mental direcionado a adolescentes de 12 a 15 anos pertencentes a escolas públicas do município do rio de janeiro. Trata-se de um projeto interdisciplinar que conta com a participação de três universidades localizadas neste mesmo município.","Claudia Reis Miliauskas"
