"nome","resumo","coordenador"
"PREVENÇÃO DE ACIDENTES NA INFÂNCIA: UM ALERTA E INTERVENÇÃO COM AÇÕES EDUCATIVAS JUNTO À POPULAÇÃO","Os acidentes são eventos não intencionais e evitáveis são uma preocupação ampla que vai além dos limites de vários contextos como o doméstico o laboral o trânsito o escolar o esportivo e o de lazer. Eles podem resultar em danos físicos e/ou emocionais. No que diz respeito às hospitalizações pediátricas os acidentes domésticos se destacam devido à sua alta taxa de incidência e morbidade sendo reconhecidos como um importante problema de saúde pública de distribuição mundial. São responsáveis ​​por grande morbidade e mortalidade na população pediátrica. No brasil as causas externas – acidentes e violência – foram responsáveis por 135.129 óbitos em 2023 segundo o datasus. Em menores de 19 anos de idade tem-se o registro de cerca de 12.359 mortes por ano. Estima-se que para cada morte por acidentes e violência tem-se de dez a vinte crianças e adolescentes que sofrem traumas intencionais e não intencionais que não são registrados mas com grande possibilidade de deixarem danos físicos e/ou psíquicos. Considerando-se que grande parte desses eventos são preveníveis e considerando a importância de situar a universidade pública brasileira com ente ativo e modificador do ambiente e comunidade em que está inserida bem como sua responsabilidade em formar e colocar o aluno como protagonista e interventor de melhoria de saúde no meio em que atua o departamento de pediatria em parceria interna com a liga de trauma da uerj projetos prematurar e sarar e parceria externa com sobrasa(sociedade brasileira de salvamento aquático) acredita ser possível atuar de forma contínua a impactar com ações educativas e interativas que resultem na diminuição da prevalência de acidentes domésticos na infância.","Kátia Farias e Silva"
"PREVENIR E INFORMAR: PRÁTICAS EDUCATIVAS PARA PROFISSIONAIS DE SAÚDE E CUIDADOS BÁSICOS PARA MAMÃE E BEBÊ","O projeto de extensão “prevenir e informar: práticas educativas para profissionais de saúde e cuidados básicos para mamãe e bebê” está em desenvolvimento no laboratório de biologia molecular e fisiologia de estreptococos (lbmfe/ibrag/dbcel) e tem como objetivo realizar atividades de popularização do patógeno (estreptococos do grupo b; egb) responsável por infecções e óbitos em gestantes e neonatos. Neste projeto a comunidade do hospital maternidade carmela dutra será esclarecida de forma simplificada e articulada sobre o egb e receberá informações para a prevenção conscientização diagnóstico e importância da triagem desse patógeno em todas as gestantes atendidas na maternidade com intuito de prevenir infecções invasivas severas e óbitos neonatais. As atividades serão planejadas e executadas por alunos de pós-graduação graduação e apoio técnico sob supervisão dos docentes orientadores. Além disso serão elaborados folders e banner para divulgação científica e palestras para os profissionais de saúde e gestantes na maternidade para a capacitação desses profissionais e para conscientização das futuras mamães da importância do rastreio desta bactéria durante os exames pré-natais como estratégia profilática. A divulgação e avaliação contínua do projeto são fundamentais para mensurar seu impacto permitir ajustes estratégicos e ampliar sua relevância na comunidade e no meio acadêmico fortalecendo sua contribuição para a saúde materno-infantil. O projeto segue um ciclo contínuo de atendimento e conscientização considerando que as gestantes e neonatos beneficiados mudam ao longo do tempo. A cada ano novas gestantes são atendidas os bebês nascem e o público impactado se renova mantendo a necessidade de capacitação prevenção e monitoramento constantes. Assim trata-se de um trabalho continuado e de longo prazo que presta serviço a uma comunidade em constante transformação garantindo a disseminação permanente do conhecimento e das práticas preventivas.","Prescilla Emy Nagao Ferreira"
"REALIDADE VIRTUAL COMO INSTRUMENTO TERAPÊUTICO HUMANIZADO APLICADO NO CONTEXTO HOSPITALAR E AMBULATORIAL COM ÊNFASE NA POPULAÇÃO IDOSA","O projeto de extensão “realidade virtual como instrumento terapêutico humanizado aplicado no contexto hospitalar e ambulatorial com ênfase na população idosa” da universidade do estado do rio de janeiro (uerj) tem por objetivo promover melhorias na qualidade de vida de pacientes internados nas enfermarias do hospital universitário pedro ernesto e de idosos vinculados à universidade aberta da terceira idade unati/uerj por meio de experiências culturais sociais e de entretenimento proporcionadas a partir de sessões de uso de aparelhos de rv. Ademais este projeto visa promover a integração social e troca de experiências multidisciplinar dos alunos de graduação dos diferentes cursos ligados à grande área da saúde. Este projeto será estruturado a partir da atuação ativa dos discentes envolvidos no projeto que orientados e supervisionados pelos docentes conduzirão as atividades utilizando os aparelhos de realidade virtual nos pacientes. As atividades terão duração média de 30 minutos incluindo a explicação sobre a tecnologia ao paciente execução da atividade aplicação de questionários acerca da experiência e de seus efeitos na qualidade de vida dos indivíduos em questão.","Ida Cristina Mannarino"
"INCENTIVO ÀS PRÁTICAS SAUDÁVEIS ATRAVÉS DA INTEGRAÇÃO ENTRE BIOLOGIA ANTROPOMETRIA E NUTRIÇÃO","O ambiente escolar é o espaço ideal para ações de saúde pública envolvendo atividade física e alimentação saudável com o objetivo de prevenir a obesidade. A defasagem escolar torna necessária a oferta de conhecimentos acessíveis às pessoas que já não estão inseridas nesse contexto. Assim disponibilizar conteúdos relacionados ao ensino básico com ênfase em nutrição e biologia facilita a compreensão daqueles que não tiveram acesso a esses conhecimentos. Uma abordagem multidisciplinar é fundamental para combater a segmentação nos estudos biológicos que muitas vezes fragmenta o conhecimento em sistemas isolados. Ao integrar diferentes áreas a prática pedagógica proporciona uma compreensão mais ampla permitindo um envolvimento significativo por parte dos participantes. Assim a antropometria atua na avaliação do estado nutricional e no monitoramento da composição corporal permitindo uma abordagem precisa e fundamentada das condições de saúde da população atendida possibilitando a detecção precoce de fatores de risco e ações educativas e preventivas mais eficazes. Após a captação será aplicado um questionário inicial para classificar a população estudada. Na primeira etapa do projeto realizaremos uma avaliação antropométrica (aa) (método isak) e um questionário de frequência alimentar. Na segunda ofereceremos uma oficina culinária focada em alimentação saudável além de palestras e rodas de conversa sobre temas relacionados à biologia nutrição e saúde. Em seguida será realizada uma segunda aa e um novo questionário de frequência alimentar a fim de avaliar o impacto das ações sobre a composição corporal e os hábitos alimentares. O objetivo é promover hábitos saudáveis por meio de aconselhamento nutricional aa oficinas culinárias palestras e materiais educativos acessíveis atendendo tanto a comunidade interna e externa além de capacitar estudantes da graduação e estabelecer parcerias para a continuidade e expansão das atividades extensionistas.","Anatalia Kutianski Gonzalez Vieira"
"LABORATÓRIO DE ESTUDOS E PESQUISAS EM SAÚDE MENTAL DA INFÂNCIA E ADOLESCÊNCIA (LEPSIA-IMS/UERJ) - GRUPO DE ESTUDOS ON-LINE: ESTUDOS CRÍTICOS SOBRE DIAGNÓSTICOS PSIQUIÁTRICOS INFANTOJUVENIS","O laboratório de estudos e pesquisas em saúde mental da infância e adolescência (lepsia) do ims/uerj articula distintos campos do saber em torno do tema da saúde mental de crianças e adolescentes por meio de iniciativas de caráter interdisciplinar englobando pesquisa ensino e extensão. Este projeto de extensão tem a finalidade de iniciar um grupo de estudos on-line aberto para estudantes trabalhadores e outros interessados na comunidade visando abordar de modo crítico os principais diagnósticos infantojuvenis presentes nas classificações psiquiátricas atuais (dsm-5 e cid 11). O grupo de estudos terá frequência quinzenal e será conduzido por discentes e egressos da pós-graduação do ims/uerj abrangendo discussões teóricas e/ou articuladas à prática no campo da atenção psicossocial e intersetores relacionadas ao impacto dessas entidades diagnósticas em diferentes áreas da sociedade em especial as famílias e as escolas criando identidades e sociabilidades em torno de categorias biomédicas. O projeto visa contribuir para a circulação de conhecimentos críticos sobre saúde mental psiquiatria e medicalização de crianças e adolescentes para um conjunto amplo de atores sociais.","Rossano Cabral Lima"
"TRABALHO INTERDISCIPLINAR FORMAÇÃO PROFISSIONAL E ASSISTÊNCIA A SAÚDE DE PESSOAS TRANSEXUAIS ASSISTIDAS NO HOSPITAL UNIVERSITÁRIO PEDRO ERNESTO E NA POLICLÍNICA PIQUET CARNEIRO","Esta proposta de extensão universitária envolve a assistência às pessoas transexuais atendidas no ambulatório identidade vinculado ao hospital universitário pedro ernesto – hupe e policlínica piquet carneiro – ppc onde se busca ampliar os cuidados de saúde ofertados a este público para além das questões cirúrgicas e biomédicas apreendendo o sujeito desse cuidado em sua totalidade e diversidade tendo como norte uma assistência integral. A população lgbtqia+ compõe um segmento estigmatizado socialmente e dentre este as travestis homens e mulheres transexuais além das pessoas não binárias constituem um grupo mais vulnerável dentre os vulneráveis encontrando diversas barreiras de acesso a saúde e demais políticas de proteção social figurando nas estatísticas nacionais como parte da população alijada dos direitos de cidadania. A assistência desse público no hupe/ppc se traduz além do atendimento às suas necessidades especificas de saúde numa possibilidade de qualificar a assistência prestada e ainda mapear o perfil dessa população e de suas necessidades sociais e de saúde no estado apontando para os gestores os vazios assistenciais existentes. Além disso a expertise nesse tipo de assistência possibilitará aos profissionais envolvidos a contribuição tanto com a formação de futuros trabalhadores do sus quanto com os que já atuam na rede pública de saúde por meio de capacitações realizadas a serem ofertadas às redes de saúde do estado. Pretende-se contribuir para a formação dos estudantes de graduação e pós-graduação da uerj haja vista a escassez da temática de gênero e diversidade na grade curricular dos cursos de graduação da área da saúde.","Marcia Cristina Brasil Santos"
"MAPEAMENTO DA REDE DE ATENÇÃO À SAÚDE DA POPULAÇÃO TRANS NO ESTADO DO RIO DE JANEIRO","A população lgbtqia+ constitui um segmento populacional historicamente negligenciado pelo estado brasileiro havendo poucas e frágeis ações que visam garantir cuidados sistemáticos e de qualidade para esse público. Historicamente as intervenções do estado relacionados a essa população esteve associado ao estigma do hiv-aids. Ainda que exista normativas legais que assegurem os direito das pessoas lgbtqia+ a oferta e estruturação de ações que lhes assegurem direitos humanos mínimos como o da saúde ainda são escassos. O rio de janeiro ainda não estruturou e implementou a política de saúde lgbt bem como ainda não pactuou junto aos municípios uma linha de cuidados e fluxos assistenciais voltados a esse segmento notadamente as pessoas transexuais inexistindo canais estruturados de assistência especifica voltada para homens e mulheres trans e as travestis que seguem carecendo de cuidados relacionados a hormonização cuidados clínicos cirúrgicos fonoterápicos e enfretamento das consequências do uso do silicone industrial sobretudo pelas travestis. Este projeto de extensão busca contribuir para o a identificação mapeamento e sistematização da assistência à saúde de pessoas trans existentes em todo o estado do rio de janeiro. Para tal o projeto propõe um levantamento sistematização e mapeamento dos serviços de saúde existentes de modo a conhecer sua realidade e suas características com a finalidade de contribuir para a identificação e qualificação da rede assistencial de saúde para o atendimento a este público supondo que existe iniciativas locais e isoladas desconhecidas do grande público. O projeto articula o tripé universitário ensino-pesquisa-extensão perpassando pela sistematização e conhecimento da realidade dessa população assistida bem como pelo estimulo a articulação das iniciativas isoladas cobrando dos gestores que cumpram o seu papel de ordenadores do cuidado.","Marcia Cristina Brasil Santos"
"PROJETO GPS RENAL: RASTREAMENTO DO RISCO DE DOENÇA RENAL CRÔNICA NOS AMBULATÓRIOS DA UERJ","O projeto visa realizar o rastreamento de pacientes com risco de desenvolvimento de doença renal crônica oculta através da aplicação da versão brasileira do questionário screening for occu/t renal disease (scored) em pacientes consultados nos ambulatórios do hospital universitário pedro ernesto (hupe) e da policlínica piquet carneiro (ppc) concomitantemente à produção e à disseminação de conteúdo educativo acerca da prevenção de doenças renais e da saúde dos rins.","Conrado Lysandro Rodrigues Gomes"
"LIGA ACADÊMICA DE NEUROANATOMIA E MICROCIRURGIA UERJ","A neuroanatomia e microcirurgia são os pilares para o diagnóstico e tratamento das doenças do sistema nervoso. Seu estudo é utilizado por diversas áreas como a psicologia neurologia psiquiatria e neurocirurgia. Tema como o acidente vascular encefálico tumores cerebrais doenças da coluna vertebral possuem grande relevância na sociedade. O rápido avanço tecnológico está permitindo novas descobertas no campo da neurociência. O entendimento desse novo cenário somado ao interesse de aprender aprimorar o ensino médico construir e perpetuar o conhecimento científico fez com que alunos professores e profissionais da área médica da universidade do estado do rio de janeiro (uerj) desenvolvessem a ideia de fundar a liga acadêmica de neuroanatomia e microcirurgia (linem). A liga amplia e estende a integração dos alunos junto aos professores fomentando a disseminação do conhecimento da anatomia aplicada à saúde a produção do conhecimento científico e a apresentação de novas abordagens cirúrgicas através de cursos workshops aulas e eventos promovidos pela linem. Tendo o hupe como referência em assistência ensino e pesquisa e estando o mesmo integrado ao sus a linem exercerá uma função de difusora de conhecimento através dos alunos de graduação de medicina da faculdade de ciências médicas da uerj. A liga atuará portanto em caráter educacional e científico contribuindo com o processo de formulação e criação do conhecimento de forma contínua possibilitando assim ações integrativas entre a uerj e a sociedade.","Pedro Henrique Da Costa Ferreira Pinto"
"HORTA COMUNITÁRIA DA PPC/UERJ: PROMOVENDO SAÚDE A PARTIR DA AGROECOLOGIA","A proposta para a construção desse projeto surge a partir da identificação da dificuldade que muitos usuários acompanhados na ppc/uerj enfrentam no acesso à alimentação saudável. Essa dificuldade pode ser compreendida de duas principais formas. A primeira refere-se diretamente à dificuldade material ou seja usuários que devido à condição socioeconômica não encontram meios para garantir sua subsistência de forma devida refletindo na demanda expressa por acesso a alimentos em muitos atendimentos realizados com a equipe de serviço social. Já a segunda tem relação com a falta de acesso à informação sobre o que seria a alimentação saudável. Percebemos em atividades de salas de espera realizadas sobre a temática do dhaa que a grande maioria dos usuários participantes desconheciam o guia alimentar para a população brasileira e não sabiam identificar alimentos como ultraprocessados apresentando uma compreensão sobre alimentação saudável baseada no senso comum o que apresenta reflexos em seu tratamento de saúde. Diante disso o presente projeto tem como objetivo através da construção de uma horta comunitária agroecológica na ppc/uerj possibilitar a usuários estudantes e profissionais da unidade de saúde o contato com práticas agroecológicas visando incentivar o interesse por conhecer o processo de produção daquilo que se consome e possibilitar o acesso a conhecimentos que proporcionem uma alimentação mais adequada aos envolvidos na perspectiva da educação em saúde. No caso de estudantes de forma mais específica propõe também despertar o interesse pela temática contribuindo no processo formativo de profissionais que futuramente poderão disseminar os conhecimentos adquiridos em seus espaços de atuação profissional. Por fim vale destacar que a ppc é uma unidade de saúde responsável pelo acompanhamento de saúde dentre outros de usuários portadores de doenças crônicas não transmissíveis (dcnt) cujo tratamento perpassa e é perpassado diretamente pela alimentação.","Raphaela Pimentel Ximenes"
"ATENDIMENTO INTEGRAL À DEMANDA AMBULATORIAL EM PSIQUIATRIA","Trata-se de projeto voltado à problematização das particularidades da demanda e acesso ao serviço ambulatorial da unidade docente-assistencial de psiquiatria/hupe (uda de psiquiatria) no intuito de avaliar sistematicamente e construir a clínica de saúde mental (sm) numa perspectiva integral e interdisciplinar.","Gabriela Chataignier Moreira"
"SIMPLIFICANDO A FISIOLOGIA ENDÓCRINA NAS REDES SOCIAIS","A fisiologia estuda o funcionamento normal dos seres vivos integrando processos químicos e físicos. No caso do organismo humano analisamos tecidos órgãos e células que atuam de forma coordenada para manter o equilíbrio vital. A fisiologia humana é dividida por sistemas como o nervoso cardiovascular respiratório renal digestório e endócrino. Este último regula e coordena a atividade celular por meio de hormônios secretados por glândulas endócrinas. Trata-se de um sistema complexo envolvendo diversas células moléculas proteínas e íons. O desequilíbrio endócrino pode levar a doenças crônicas de grande impacto na saúde pública como diabetes obesidade e disfunções da tireoide. Diante da complexidade dos mecanismos envolvidos muitos estudantes e leigos encontram dificuldades para compreender esses processos. Este projeto busca simplificar o ensino da fisiologia endócrina e das patologias associadas além de divulgar a ciência de forma clara e acessível. O público-alvo inclui a população em geral estudantes do ensino médio e alunos de graduação e pós-graduação da área da saúde. A proposta utiliza plataformas digitais como instagram youtube e site para veicular conteúdos educativos (postagens podcasts e videocasts) aproveitando o amplo uso das mídias sociais no brasil. A ação fortalece o vínculo entre universidade e sociedade estimula a divulgação científica e desenvolve entre os estudantes envolvidos habilidades em comunicação e popularização da ciência para além dos muros acadêmicos.","Rosiane Aparecida Miranda"
"MEDENSINA","A criação deste projeto se seu por interesse manifestado pelos próprios estudantes de medicina da uerj cabo frio. Recentemente eles começaram a executar tarefas programadas pelas disciplina de saúde coletiva no campo das doenças crônicas entre as quais elencaram hipertensão arterial asma e tuberculose. Em grupos os estudantes problematizaram questões a serem trabalhadas e procuraram ativamente diferentes locais e pessoas para interagir incluindo pacientes profissionais de saúde e a população em geral. Com protagonismo e criatividade trabalharam colaborativamente realizaram entrevistas produziram vídeos e propuseram ações para ajudar a atenuar problemas que encontraram. Os locais foram diversos e incluíram unidades básica de saúde casa de convivência de idosos o próprio campus da uerj e o hospital universitário reitor hesio cordeiro. Um destaque uniforme identificado pelos grupos foi a necessidade de ações de educação em saúde. Em todas os locais a fcm uerj cabo frio foi muito bem recebida e convidada a continuar. A alegria e a motivação dos estudantes a partir das vivências que tiveram fizeram com que eles próprios pedissem outras continuidade de ações como estas com foco na educação em saúde inclusive já o “batizando” com o nome med-ensina. O desafio foi mais do que aceito não só pela relevância mas também por sua pertinência.","Rafael Cardoso Maciel Costa Silva"
"CUIDADO (EM) COLETIVO: LABORATÓRIO DE FORMAÇÃO E DE PRÁTICAS DE CUIDADO COLETIVO NA UNIVERSIDADE","O projeto objetiva sistematizar aprimorar e disseminar a experiência de trabalho do departamento de acolhida saúde psicossocial e bem-estar - daspb vinculado à pró-reitoria de políticas e assistência estudantil pr4 com grupos e coletivos de estudantes de graduação e pós graduação. O daspb desenvolve ações em abordagem transdisciplinar e interprofissional que favorecem o cuidado e a permanência estudantil qualificada na interseção do campo da saúde e da educação. A partir das atividades desenvolvidas no centro de estudos já implantado busca-se ampliar a interlocução com pesquisadores estudantes instituições universitárias movimentos sociais e outras formas de organização coletiva visando o aprofundamento a troca de experiências e a disseminação do conhecimento produzido acerca do cuidado coletivo na experiência universitária. Pretende-se também dentro da perspectiva da cartografia psicossocial fazer um mapa do cuidado entre estudantes da uerj construindo com eles espaços de diálogo que toquem em temáticas presentes na vivência estudantil que impactam a saúde mental e o senso de pertencimento. O projeto pretende assim valorizar a dimensão da invenção que se dá a partir do encontro com o outro e do cuidado como criação de possibilidades produção de sociabilidades e subjetividades. Pretende-se compreender e explorar como os grupos de estudantes produzem alianças sentidos e senso de pertencimento no espaço universitário e como a coletividade pode ser um dispositivo de cuidado. Como produto planeja-se a realização de encontros mensais do centro de estudos com a presença de convidados e abertos a todas as pessoas que se interessem pelo tema; a criação de espaços permanentes de encontro e diálogo entre grupos de estudantes e a produção de materiais de divulgação didático-pedagógicos artigos científicos e intervenções artísticas que versem sobre cuidado e senso de pertencimento na universidade.","Clarice Cezar Cabral"
"GRUPO DE TRABALHO ANTIRRACISMO: EXTENSÃO E PESQUISA SOBRE AS RELAÇÕES ÉTNICO-RACIAIS E SAÚDE DA POPULAÇÃO NEGRA","O presente projeto surgiu no setor do serviço social em 2020 como uma demanda vinda de profissionais que sofrem racismo e da população usuária do serviço a princípio se pensou num material educativo para se trabalhar. Tem como objetivo fomentar as discussões sobre racismo estrutural no âmbito hospitalar além de contribuir com ações socioeducativas voltadas ao enfrentamento de práticas racistas. Para isso foi criado um grupo de trabalho que vem pensando ações antirracistas para atuar no espaço hospitalar e pesquisar sobre a saúde da população negra e as relações étnico-raciais nos serviços de saúde do complexo de saúde da uerj. Cabe ao grupo de trabalho antirracismo pesquisar e debater como se dão as relações étnico-raciais nas instituições em especial na instituição hospitalar. Pensar estratégias de trabalho junto aos profissionais e usuários do hospital universitário pedro ernesto (hupe/uerj) e parcerias extra-muros. E a sua principal ação é o planejamento e promoção anual do ""seminário saúde da população negra em pauta"" com diferentes temas debatidos a cada edição.","Luma Marcelino Corrêa"
